{"budgets":[{"amendments":[{"approvalRef":"syn-budget-approval-002","date":"2000-02-01","reason":"Synthetic amendment: contract services raised to cover restricted fund A work (demo).","version":"2"}],"approvalRef":"syn-budget-approval-001","approvedDate":"1999-12-15","budgetId":"syn-budget-alpha","currency":"USD","lines":[{"amountMinorUnits":"120000","categoryId":"program-supplies"},{"amountMinorUnits":"250000","categoryId":"contract-services"}],"programId":"program-alpha","responsibleRole":"Synthetic role: program lead","restrictionId":null,"varianceNote":"Synthetic: supplies came in under budget after the corrected invoice; contract services matched the amended budget (demo).","version":"2"},{"amendments":[],"approvalRef":"syn-budget-approval-003","approvedDate":"1999-12-15","budgetId":"syn-budget-beta","currency":"USD","lines":[{"amountMinorUnits":"200000","categoryId":"contract-services"},{"amountMinorUnits":"100000","categoryId":"program-supplies"}],"programId":"program-beta","responsibleRole":"Synthetic role: program lead","restrictionId":"fund-b","varianceNote":"Synthetic: contract services under budget by the amount still open at period end (demo).","version":"1"}],"demoLabel":"Demo data — not VT Infinite's financial records.","entityId":"demo","environment":"synthetic-demo","periodId":"2000-Q1","schema":"marrs-rover.budgets.1"}